{"schemaVersion":"environment-cost-server-cost-slice-1.0","areaId":"ichigaya-integration-fixture","timestamp":"2025-08-01T08:00:00+09:00","topologyContentFingerprintSha256":"1885fdf86386321d5923f8c9c67b0e007811c019afdcfa07a0ae53b8bf58f405","environmentCostFingerprintSha256":"3333333333333333333333333333333333333333333333333333333333333333","physicalEdgeCount":2,"statusCounts":{"available":0,"partial":1,"missing":1},"costs":[[1,3,2,1,0.25,75],[0,0,0,0,null,null]],"contentFingerprintSha256":"136b8013f20eca5b92bdc747c91511425340bdc985a81f776fbfdf9e6bcb7a47"}
