{"schemaVersion":"environment-cost-server-cost-slice-1.0","areaId":"route-server-fixture","timestamp":"2025-08-01T12:00:00+09:00","topologyContentFingerprintSha256":"bbe3375890f4d9fe3c63e2c559136f48d20e7d6e55238782c28f1faef466ea14","environmentCostFingerprintSha256":"6666666666666666666666666666666666666666666666666666666666666666","physicalEdgeCount":6,"statusCounts":{"available":6,"partial":0,"missing":0},"costs":[[2,2,2,0,0.1,90],[2,2,2,0,0.1,90],[2,2,2,0,0.5,57.5],[2,2,2,0,0.5,57.5],[2,2,2,0,0.95,7.500000000000007],[2,2,2,0,0.95,7.500000000000007]],"contentFingerprintSha256":"cbe00358dab6382e7c4fa0226b4c1b3c25125371b8691277501297fd3e804c52"}
